{
  "contract_version": "investigation-evidence/v1",
  "analysis_version": "trace-attribute-deviations/v1",
  "request": {
    "scope": {
      "service_name": "checkout",
      "environment": "production"
    },
    "requested_window": {
      "start": "2026-07-15T08:00:00Z",
      "end": "2026-07-15T08:15:00Z",
      "boundary": "half-open"
    },
    "effective_window": {
      "start": "2026-07-15T08:00:00Z",
      "end": "2026-07-15T08:15:00Z",
      "boundary": "half-open"
    },
    "comparison_mode": "latency",
    "latency_threshold_ms": 500
  },
  "evidence": {
    "partial": false,
    "truncated": false,
    "warnings": [],
    "partial_errors": [],
    "target_count": 100,
    "control_count": 100,
    "provenance": {
      "source": "trace-analytics",
      "observed_at": "2026-07-15T08:16:00Z",
      "query_id": null
    }
  },
  "interpretation": {
    "evidence_quality": "medium",
    "claim_type": "correlation",
    "summary": "service.version=v2 differs by 40.00 percentage points between the compared cohorts.",
    "limitations": [
      "Association is not proof of cause."
    ]
  },
  "data": {
    "candidates": [
      {
        "attribute": "service.version",
        "target_missing": 0,
        "control_missing": 0,
        "distinct_values": 1
      }
    ],
    "deviations": [
      {
        "attribute": "service.version",
        "value": "v2",
        "target_count": 60,
        "control_count": 20,
        "target_share": 0.6,
        "control_share": 0.2,
        "percentage_point_delta": 40,
        "ratio": 3,
        "direction": "target",
        "score": 40,
        "rank": 1,
        "interpretation": "v2 for service.version differs by 40.00 percentage points between target (60/100) and control (20/100). This is an association, not proof of cause."
      }
    ],
    "representative_traces": []
  },
  "follow_ups": [
    "Inspect confirming and contradicting traces before recommending action."
  ]
}
